<?xml version="1.0" encoding="ISO-8859-1"?>

<!--
    Document   : JSpeccy.xml
    Created on : 23 de diciembre de 2010, 11:16
    Author     : jsanchez
    Description:
        Purpose of the document follows.
-->

<ns0:JSpeccySettings  xmlns:xsi='http://www.w3.org/2001/XMLSchema-instance'
   xmlns:ns0='http://xml.netbeans.org/schema/JSpeccy'
   xsi:schemaLocation='http://xml.netbeans.org/schema/JSpeccy JSpeccy.xsd'>
    <ns0:SpectrumSettings>
        <ns0:Issue2>false</ns0:Issue2>
        <ns0:AYEnabled48k>false</ns0:AYEnabled48k>
        <ns0:mutedSound>false</ns0:mutedSound>
        <ns0:loadingNoise>true</ns0:loadingNoise>
        <ns0:ULAplus>false</ns0:ULAplus>
        <ns0:defaultModel>1</ns0:defaultModel>
        <ns0:framesInt>2</ns0:framesInt>
        <ns0:doubleSize>false</ns0:doubleSize>
        <ns0:multifaceEnabled>false</ns0:multifaceEnabled>
        <ns0:mf128on48K>false</ns0:mf128on48K>
        <ns0:hifiSound>false</ns0:hifiSound>
    </ns0:SpectrumSettings>
    <ns0:MemorySettings>
        <ns0:RomsDirectory></ns0:RomsDirectory>
        <ns0:Rom48k>spectrum.rom</ns0:Rom48k>
        <ns0:Rom128k0>128-0.rom</ns0:Rom128k0>
        <ns0:Rom128k1>128-1.rom</ns0:Rom128k1>
        <ns0:RomPlus20>plus2-0.rom</ns0:RomPlus20>
        <ns0:RomPlus21>plus2-1.rom</ns0:RomPlus21>
        <ns0:RomPlus30>plus3-0.rom</ns0:RomPlus30>
        <ns0:RomPlus31>plus3-1.rom</ns0:RomPlus31>
        <ns0:RomPlus32>plus3-2.rom</ns0:RomPlus32>
        <ns0:RomPlus33>plus3-3.rom</ns0:RomPlus33>
        <ns0:RomMF1>mf1.rom</ns0:RomMF1>
        <ns0:RomMF128>mf128.rom</ns0:RomMF128>
        <ns0:RomMFPlus3>mfplus3.rom</ns0:RomMFPlus3>
    </ns0:MemorySettings>
    <ns0:TapeSettings>
        <ns0:flashload>true</ns0:flashload>
        <ns0:accelerateLoading>true</ns0:accelerateLoading>
        <ns0:enableSaveTraps>true</ns0:enableSaveTraps>
        <ns0:highSamplingFreq>false</ns0:highSamplingFreq>
    </ns0:TapeSettings>
    <ns0:KeyboardJoystickSettings>
        <ns0:JoystickModel>0</ns0:JoystickModel>
    </ns0:KeyboardJoystickSettings>
    <ns0:AY8912Settings>
        <ns0:soundMode>0</ns0:soundMode>
    </ns0:AY8912Settings>
    <ns0:RecentFilesSettings>
        <ns0:recentFile0></ns0:recentFile0>
        <ns0:recentFile1></ns0:recentFile1>
        <ns0:recentFile2></ns0:recentFile2>
        <ns0:recentFile3></ns0:recentFile3>
        <ns0:recentFile4></ns0:recentFile4>
        <ns0:lastSnapshotDir></ns0:lastSnapshotDir>
        <ns0:lastTapeDir></ns0:lastTapeDir>
    </ns0:RecentFilesSettings>

</ns0:JSpeccySettings>
